{
  "rfq_id": "RFQ-2026-00001",
  "customer_name": "Example Aerospace",
  "product_id": "__KNOWN_PRODUCT_ID__",
  "requested_quantity": 100,
  "spot_material_surcharge_pct": 0.08,
  "requested_delivery_date": "2026-08-31",
  "requested_discount_pct": 0.00,
  "sales_rep": "Atsushi Mano",
  "request_channel": "manual_test"
}
